{
  "$schema": "https://json-schema.org/draft/2020-12/schema",
  "$id": "https://example.com/schemas/ImageSidecar.schema.json",
  "title": "Image Sidecar Metadata",
  "type": "object",
  "additionalProperties": false,
  "properties": {
    "title": {
      "type": "string",
      "default": ""
    },
    "description": {
      "type": "string",
      "default": ""
    },
    "ai_generated": {
      "type": "boolean",
      "description": "Indicates whether AI generated the current title or description.",
      "default": false
    },
    "ai_details": {
      "type": "object",
      "default": {},
      "additionalProperties": false,
      "properties": {
        "provider": {
          "type": "string",
          "default": ""
        },
        "model": {
          "type": "string",
          "default": ""
        },
        "prompt": {
          "type": "string",
          "default": ""
        },
        "response_id": {
          "type": "string",
          "default": ""
        },
        "finish_reason": {
          "type": "string",
          "default": ""
        },
        "created": {
          "type": "number",
          "default": 0
        },
        "attempted_at": {
          "type": "number",
          "default": 0
        },
        "status": {
          "type": "string",
          "default": ""
        },
        "error": {
          "type": "string",
          "default": ""
        },
        "error_body": {
          "type": "string",
          "default": ""
        },
        "raw_response": {
          "type": "object",
          "default": {}
        }
      }
    },
    "reviewed": {
      "type": "boolean",
      "default": false
    },
    "detected_at": {
      "type": "number",
      "description": "Unix epoch seconds when the image was first detected.",
      "default": 0
    }
  },
  "required": [
    "title",
    "description",
    "ai_generated",
    "ai_details",
    "reviewed",
    "detected_at"
  ]
}
